{
  "$schema": "../schemas/rpas-tar-col.schema.json",
  "artifactMetadata": {
    "artifactId": "TAR-AEV-003",
    "prefix": "TAR",
    "version": "2.3.0",
    "status": "Production-Attested",
    "lastModified": "2026-06-18T16:15:00Z",
    "sourceOfTruth": "https://github.com/CBA-Consult/ICT-Governance-Framework-Application/tree/main/governance/rpas/scripts/"
  },
  "authorityMatrix": {
    "governanceRole": "Cloud Platform Stewards",
    "decidingAuthority": "Strategic Governance Council",
    "executingSystem": "GitHub Actions / Local Pre-Commit Runner",
    "humanInTheLoopRequired": false,
    "escalationPath": "RPAS-ESC.md"
  },
  "complianceMapping": {
    "framework": "NIST_CSF_2.0",
    "primaryCategory": "PR.DS",
    "enforcedBy": "Pester Verification Pipeline",
    "auditLineage": "append-only"
  },
  "systematics": {
    "integrationMode": "in-repo",
    "checksumValidation": {
      "enabled": true,
      "targetFile": "governance/rpas/governance_checksum.json"
    },
    "driftTaxonomyMapping": {
      "gateBypass": "process",
      "checksumMismatch": "governance",
      "scriptModification": "process"
    }
  }
}
